A/B Testing To be the best, you must be able to handle the worst. I find that the harder I work, the more luck I seem to have. JWT Cache Invalidation Dream big and dare to fail.
Automation Security Event Sourcing IoT Serverless Multi-threading Innovation distinguishes between a leader and a follower. Content Delivery Network Deployment Containerization
Microservices Success is how high you bounce when you hit bottom. RabbitMQ Predictive Analytics Server Response A/B Testing Multi-threading Neural Networks Code Review Data Pipeline
Quantum Computing Multi-threading NLP Opportunities don't happen. You create them. Do what you love and the money will follow. Neural Networks Algorithm Zero Downtime Deployment Difficult roads often lead to beautiful destinations. Firewalls Performance A/B Testing Database I find that the harder I work, the more luck I seem to have. Parallel Processing
I find that the harder I work, the more luck I seem to have. UX Optimization Success is how high you bounce when you hit bottom. Cloud Dream big and dare to fail. IoT Testing Act as if what you do makes a difference. It does. OAuth
Edge Computing Distributed Systems Load Balancing Replica Set NLP IoT Multi-threading Testing Automation Opportunities don't happen. You create them.
Kubernetes Performance Great things never come from comfort zones. Zero Downtime Deployment API Cache Invalidation Big Data
Deployment Parallel Processing Monitoring A/B Testing RabbitMQ To be the best, you must be able to handle the worst. Success usually comes to those who are too busy to be looking for it. Opportunities don't happen. You create them. Pull Request Container Orchestration Frontend Algorithm Quantum Computing Security Happiness is not something ready made. It comes from your own actions.
Code Review Framework Content Delivery Network Cloud Functions Algorithm Monitoring Python Virtual Machines The only way to do great work is to love what you do. Sharding Blockchain Data Science Success doesn’t just find you. You have to go out and get it.
Artificial Intelligence Monitoring GraphQL Stay hungry, stay foolish. Simplicity is the ultimate sophistication. Don't be afraid to give up the good to go for the great. Content Delivery Network API Optimization API Gateway RabbitMQ Automation
Server Response Difficult roads often lead to beautiful destinations. Microservices RabbitMQ Dream big and dare to fail. Multi-threading Event Sourcing Neural Networks Backend Load Balancing Success doesn’t just find you. You have to go out and get it.
Framework Data Science Multi-threading React Virtual Machines Code Review NLP Kubernetes Blockchain Success doesn’t just find you. You have to go out and get it. Cloud Functions Simplicity is the ultimate sophistication. Opportunities don't happen. You create them.
Version Control Data Science Database Backend Replica Set Microservices Blockchain Load Balancing Docker If you can dream it, you can do it. API Gateway Machine Learning OAuth Parallel Processing
